{
  "$schema": "https://fluidsbench.org/schemas/v1/submission.schema.json",
  "schema_version": "1.0",
  "submission_id": "drivaernetpp-pointnet-large",
  "model": "PointNet-Large",
  "model_type": "Point cloud",
  "model_types": [
    "Point cloud"
  ],
  "training_regime": "from_scratch",
  "target_data_used": "official_train",
  "external_pretraining": false,
  "pretraining_data": [],
  "dataset": "DrivAerNet++",
  "dataset_id": "drivaernetplusplus",
  "dataset_version": "prototype-1",
  "split": "Default",
  "split_id": "default",
  "case_set_id": "default",
  "split_sha256": "6ae0138c4ea9482f36592ed6064c37be44370134cc2b747f3fc8b735780d6334",
  "parameter_count_millions": 32.58,
  "submitter_name": "Neil Ashton",
  "institution": "FluidsBench dummy data",
  "paper_url": "",
  "code_url": "",
  "submitted_at": "2025-11-25",
  "evaluation": {
    "reference_version": "prototype-1",
    "code_revision": "prototype-dummy-data",
    "command": "not-applicable (illustrative dummy data)",
    "evidence_file": "evaluation-evidence.json",
    "evidence_sha256": "3bd6c030683a8ffefec410961f34f8c8203e1df4c0da7e89cc1fa3d0f132bd78"
  },
  "approval": {
    "status": "prototype",
    "note": "Illustrative dummy data; not scientifically reviewed or approved."
  },
  "metric_values": {
    "overall_score": 74.62500000000001,
    "surface_pressure_rel_l2": 25.375,
    "surface_pressure_equal_entity_rel_l2": 24.36,
    "surface_pressure_rel_l1": 17.539,
    "surface_pressure_r2": 0.903
  },
  "profile_data": {
    "format": "fluidsbench-profile-chunks-v1",
    "index_file": "profiles/index.json",
    "case_count": 1,
    "case_set_id": "default"
  },
  "note": "CarBench Table 1 reports DrivAerNet++ surface-pressure Rel L2, pressure-field R2, and parameter count; force, volume, wall-shear, and profile metrics are placeholders until a DrivAerNet++ evaluator is available. Dummy JSON mirrors the existing generated placeholder profile curves so the frontend can load this row through the submission feed. Prototype dual-weight values are illustrative policy fixtures, not recomputations from public fields.",
  "methodology": {
    "format": "fluidsbench-method-v1",
    "record_kind": "prototype_fixture",
    "record_note": "Leaderboard interface fixture only. The model name, broad family, and nominal parameter count mirror the prototype row; component breakdown, hyperparameters, training run, checkpoint, and timing were not submitted or independently verified. This record must not be cited as the authors' methodology.",
    "architecture": {
      "description": "PointNet-Large prototype row (Point cloud). Larger PointNet-family variant. The repository does not contain a verified layer-by-layer configuration, so the nominal parameter count is represented as one aggregate component.",
      "total_parameter_count": 32580000,
      "parameter_count_basis": "rounded_from_reported_millions",
      "submitter_trainable_parameter_count": 0,
      "components": [
        {
          "id": "prototype-surrogate",
          "family": "Point cloud",
          "role": "Prototype drivaernetplusplus field predictor.",
          "description": "Aggregate placeholder for the named PointNet-Large architecture. Larger PointNet-family variant. No unverified internal split is invented.",
          "parameter_count": 32580000
        }
      ],
      "key_hyperparameters": [
        {
          "id": "reported-model-variant",
          "component_ids": [
            "prototype-surrogate"
          ],
          "name": "reported_model_variant",
          "value": "PointNet-Large",
          "description": "Only the named prototype model variant is recorded; exact depth, width, attention, neighborhood, and optimizer settings were not encoded in this dummy submission."
        }
      ],
      "input_features": [
        {
          "id": "native-geometry",
          "component_ids": [
            "prototype-surrogate"
          ],
          "name": "native_geometry_coordinates",
          "domain": "mesh",
          "component_count": 3,
          "description": "3D geometry or mesh coordinates associated with the dataset's official supports. Exact feature engineering was not recorded for this prototype row."
        }
      ],
      "predicted_fields": [
        {
          "field_id": "surface-pressure-native.p",
          "domain": "surface",
          "component_count": 1,
          "component_ids": [
            "prototype-surrogate"
          ],
          "production": "direct_model_output",
          "description": "Prototype declaration for Dataset-native kinematic pressure on every official DrivAerNet++ surface point. The fixture does not retain executable predictions proving whether the named architecture produced this quantity directly."
        }
      ]
    },
    "data_handling": {
      "normalization": "Not recorded for this prototype fixture; no normalization statistics are asserted.",
      "preprocessing": "Not recorded for this prototype fixture; no remeshing or feature construction procedure is asserted.",
      "sampling": "Not recorded for this prototype fixture; the leaderboard's dummy coverage must not be interpreted as the named model's sampling policy."
    },
    "training": {
      "stages": [
        {
          "id": "prototype-training-not-recorded",
          "status": "prototype_not_recorded",
          "component_ids": [
            "prototype-surrogate"
          ],
          "description": "No executable training run, optimizer configuration, random seed, or training-compute receipt accompanies this dummy row."
        }
      ]
    },
    "checkpoints": [],
    "inference_compute": {
      "status": "not_measured",
      "reason": "The prototype leaderboard row was not produced by a retained model checkpoint, so end-to-end inference time and hardware are unavailable."
    }
  }
}
