{
  "$schema": "https://fluidsbench.org/schemas/v1/submission.schema.json",
  "schema_version": "1.0",
  "submission_id": "graph-u-net",
  "model": "Graph U-Net",
  "model_type": "GNN",
  "model_types": [
    "GNN"
  ],
  "training_regime": "from_scratch",
  "target_data_used": "official_train",
  "external_pretraining": false,
  "pretraining_data": [],
  "dataset": "AhmedML",
  "dataset_id": "ahmedml",
  "dataset_version": "prototype-1",
  "split": "Super scarce",
  "split_id": "super_scarce",
  "case_set_id": "standard",
  "split_sha256": "250bdc465f7062c68445e1b88447f68df76d8afeaf49fc9b7b6be2245dfdeee8",
  "parameter_count_millions": 14.11,
  "submitter_name": "Neil Ashton",
  "institution": "FluidsBench dummy data",
  "paper_url": "",
  "code_url": "",
  "submitted_at": "2025-06-13",
  "evaluation": {
    "reference_version": "prototype-1",
    "code_revision": "prototype-dummy-data",
    "command": "not-applicable (illustrative dummy data)",
    "evidence_file": "evaluation-evidence.json",
    "evidence_sha256": "ef4c6f7ae10d59828525a14acc5705502ed3f0f77155d8f984f886599d8adb4c"
  },
  "approval": {
    "status": "prototype",
    "note": "Illustrative dummy data; not scientifically reviewed or approved."
  },
  "metric_values": {
    "surface_pressure_rel_l2": 6.42,
    "surface_pressure_rel_l1": 4.622,
    "surface_wall_shear_rel_l2": 7.21,
    "surface_wall_shear_rel_l1": 4.903,
    "volume_velocity_rel_l2": 4.14,
    "volume_velocity_rel_l1": 2.898,
    "volume_pressure_rel_l2": 5.17,
    "volume_pressure_rel_l1": 3.567,
    "cd_r2": 0.93,
    "cl_r2": 0.902,
    "velocity_profile_r2": 0.884,
    "cp_cut_r2": 0.891,
    "surface_pressure_mae": 32.4,
    "surface_pressure_rmse": 44.9,
    "surface_wall_shear_mae": 0.59,
    "surface_wall_shear_rmse": 0.87,
    "volume_velocity_mae": 1.16,
    "volume_velocity_rmse": 1.66,
    "volume_pressure_mae": 21.4,
    "volume_pressure_rmse": 31,
    "c_drag_mae": 0.009,
    "c_lift_mae": 0.0182,
    "field_score": 62.70666666666666,
    "force_score": 91.88,
    "diagnostic_score": 88.68,
    "overall_score": 76.49333333333334,
    "surface_pressure_equal_entity_rel_l2": 6.8052,
    "surface_wall_shear_equal_entity_rel_l2": 7.6426,
    "volume_velocity_physical_rel_l2": 3.90566,
    "volume_pressure_physical_rel_l2": 4.877358
  },
  "profile_data": {
    "format": "fluidsbench-profile-chunks-v1",
    "index_file": "profiles/index.json",
    "case_count": 50,
    "case_set_id": "standard"
  },
  "note": "Baseline L2 metrics from AB-UPT v2 appendix; L1 and profile R2 values are illustrative. Dummy JSON mirrors the existing generated placeholder profile curves so the frontend can load this row through the submission feed. The displayed split assignment is illustrative dummy data. Prototype dual-weight values are illustrative policy fixtures, not recomputations from public fields.",
  "methodology": {
    "format": "fluidsbench-method-v1",
    "record_kind": "prototype_fixture",
    "record_note": "Leaderboard interface fixture only. The model name, broad family, and nominal parameter count mirror the prototype row; component breakdown, hyperparameters, training run, checkpoint, and timing were not submitted or independently verified. This record must not be cited as the authors' methodology.",
    "architecture": {
      "description": "Graph U-Net prototype row (GNN). Multiscale graph encoder-decoder family with graph pooling and unpooling. The repository does not contain a verified layer-by-layer configuration, so the nominal parameter count is represented as one aggregate component.",
      "total_parameter_count": 14110000,
      "parameter_count_basis": "rounded_from_reported_millions",
      "submitter_trainable_parameter_count": 0,
      "components": [
        {
          "id": "prototype-surrogate",
          "family": "GNN",
          "role": "Prototype ahmedml field predictor.",
          "description": "Aggregate placeholder for the named Graph U-Net architecture. Multiscale graph encoder-decoder family with graph pooling and unpooling. No unverified internal split is invented.",
          "parameter_count": 14110000
        }
      ],
      "key_hyperparameters": [
        {
          "id": "reported-model-variant",
          "component_ids": [
            "prototype-surrogate"
          ],
          "name": "reported_model_variant",
          "value": "Graph U-Net",
          "description": "Only the named prototype model variant is recorded; exact depth, width, attention, neighborhood, and optimizer settings were not encoded in this dummy submission."
        }
      ],
      "input_features": [
        {
          "id": "native-geometry",
          "component_ids": [
            "prototype-surrogate"
          ],
          "name": "native_geometry_coordinates",
          "domain": "mesh",
          "component_count": 3,
          "description": "3D geometry or mesh coordinates associated with the dataset's official supports. Exact feature engineering was not recorded for this prototype row."
        }
      ],
      "predicted_fields": [
        {
          "field_id": "surface-native.pMean",
          "domain": "surface",
          "component_count": 1,
          "component_ids": [
            "prototype-surrogate"
          ],
          "production": "direct_model_output",
          "description": "Prototype declaration for Dataset-native mean surface pressure used by the AhmedML surface-pressure metrics. The fixture does not retain executable predictions proving whether the named architecture produced this quantity directly."
        },
        {
          "field_id": "surface-native.wallShearStressMean",
          "domain": "surface",
          "component_count": 3,
          "component_ids": [
            "prototype-surrogate"
          ],
          "production": "direct_model_output",
          "description": "Prototype declaration for Dataset-native mean wall-shear-stress vector used by the AhmedML surface wall-shear metrics. The fixture does not retain executable predictions proving whether the named architecture produced this quantity directly."
        },
        {
          "field_id": "flow-domain-native.UMean",
          "domain": "volume",
          "component_count": 3,
          "component_ids": [
            "prototype-surrogate"
          ],
          "production": "direct_model_output",
          "description": "Prototype declaration for Dataset-native mean velocity vector used by the AhmedML flow-domain metrics. The fixture does not retain executable predictions proving whether the named architecture produced this quantity directly."
        },
        {
          "field_id": "flow-domain-native.pMean",
          "domain": "volume",
          "component_count": 1,
          "component_ids": [
            "prototype-surrogate"
          ],
          "production": "direct_model_output",
          "description": "Prototype declaration for Dataset-native mean pressure used by the AhmedML flow-domain metrics. The fixture does not retain executable predictions proving whether the named architecture produced this quantity directly."
        }
      ]
    },
    "data_handling": {
      "normalization": "Not recorded for this prototype fixture; no normalization statistics are asserted.",
      "preprocessing": "Not recorded for this prototype fixture; no remeshing or feature construction procedure is asserted.",
      "sampling": "Not recorded for this prototype fixture; the leaderboard's dummy coverage must not be interpreted as the named model's sampling policy."
    },
    "training": {
      "stages": [
        {
          "id": "prototype-training-not-recorded",
          "status": "prototype_not_recorded",
          "component_ids": [
            "prototype-surrogate"
          ],
          "description": "No executable training run, optimizer configuration, random seed, or training-compute receipt accompanies this dummy row."
        }
      ]
    },
    "checkpoints": [],
    "inference_compute": {
      "status": "not_measured",
      "reason": "The prototype leaderboard row was not produced by a retained model checkpoint, so end-to-end inference time and hardware are unavailable."
    }
  }
}
